"Variable","Variable Number","Topic","Topic Number","Subtopic","Subtopic Number","Survey Years","Availability","Description","Table Name","Type","Edit Flag Variable","Imputation Strategy","Response Codes","Question Text","Instrument Variable Name(s)","Disclosure","Conditions in Universe","User Notes"
"HOWBUY",4,"Housing Costs",8,"Owner's Purchase, Value, and Debt",5,"2021 National, 2021 Metro, 2019 National, 2019 Metro, 2017 National, 2017 Metro, 2015 National, 2015 Metro","PUF","Description of how owner obtained unit","HOUSEHOLD","Character","JHOWBUY","Coming soon","1: Buy the house already built||2: Sign a sales agreement that included the land as well as the cost of building the unit||3: Have a general contractor build it on your own land (also includes leased land)||4: Build it yourself on your own land||5: Receive it as a gift or inheritance||M or -9: Not reported||N or -6: Not applicable","See User Notes","See User Notes","None","INTSTATUS = '1' and TENURE = '1'","HOWBUY is determined using CUSHOM (How did you obtain this unit?) and PREOCC (Did you receive the home as a gift or inheritance or did you purchase it?)."
"LEADINSP",5,"Housing Costs",8,"Owner's Purchase, Value, and Debt",5,"2021 National, 2021 Metro, 2019 National, 2019 Metro, 2017 National, 2017 Metro, 2015 National, 2015 Metro","PUF","Flag indicating lead pipes inspected before purchase","HOUSEHOLD","Character","JLEADINSP","Coming soon","1: Yes||2: No||M or -9: Not reported||N or -6: Not applicable","When you got this unit, did anyone make inquiries or have this unit inspected or tested for lead pipes?","TPBPIP","None","INTSTATUS = '1' and TENURE = '1'",
"LOTVAL",6,"Housing Costs",8,"Owner's Purchase, Value, and Debt",5,"2021 National, 2021 Metro, 2019 National, 2019 Metro, 2017 National, 2017 Metro, 2015 National, 2015 Metro","IUF Only","Current market value of land on which mobile / manufactured home now sits","HOUSEHOLD","Numeric","JLOTVAL","Coming soon","1 : 9999997: $1 to $9,999,997||9999998: $9,999,998 or more||M or -9: Not reported||N or -6: Not applicable","See User Notes","LVALUE","Withheld","INTSTATUS = '1' and TENURE = '1' and BLD = '01' and OWNLOT = '1'","Respondents who live in MH are first asked OWNLOT1 (Do you own the land on which the manufactured/mobile home sits?), and if yes, are then asked LVALUE (How much do you think the land would sell for on today's market?)."
"MARKETVAL",7,"Housing Costs",8,"Owner's Purchase, Value, and Debt",5,"2021 National, 2021 Metro","PUF","Current market value of unit","HOUSEHOLD","Numeric","JMARKETVAL","Coming soon","1 : 9999997: $1 to $9,999,997||9999998: $9,999,998 or more||N or -6: Not applicable","See User Notes","See User Notes","Noise","(INTSTATUS = '1' and TENURE = '1') or (INTSTATUS in ('2' '3') and VACANCY in ('03' '05' '06' '07' '08' '09' '10' '11') )","Both VALUE1 and VALUE3 ask about the current market value of the unit, but the specific question text seen by respondents varies considerably. VALUE1 is asked multiple ways depending on the structure type and other factors. Additionally, the value of the land is collected separately for mobile homes (see LOTVAL)."
"MORTSTAT",8,"Housing Costs",8,"Owner's Purchase, Value, and Debt",5,"2021 National, 2021 Metro, 2019 National, 2019 Metro, 2017 National, 2017 Metro, 2015 National, 2015 Metro","IUF Only","Number and type of mortgages or similar debts","HOUSEHOLD","Character","JMORTSTAT","Coming soon","1: No mortgage, home equity loan, or home equity line of credit||2: One regular mortgage or home equity lump sum loan||3: Two or more regular mortgages or lump sums and no home equity line of credit||4: At least one regular mortgage or lump sum and at least one home equity line of credit||5: One or more home equity line of credit only||6: Reverse mortgage only","NA","NA","Withheld","INTSTATUS in ('1' '2' '3')",
"PRICE",9,"Housing Costs",8,"Owner's Purchase, Value, and Debt",5,"2021 National, 2021 Metro, 2019 National, 2019 Metro, 2017 National, 2017 Metro, 2015 National, 2015 Metro","IUF Only","Purchase price","HOUSEHOLD","Numeric","JPRICE","Coming soon","1 : 9999997: $1 to $9,999,997||9999998: $9,999,998 or more||M or -9: Not reported||N or -6: Not applicable","See User Notes","See User Notes","Withheld","INTSTATUS = '1' and TENURE = '1' and HOWBUY <> '5'","PRICE is determined by either LPRICEQ (What was the price of the home?) or CPRICEQ (What was the construction cost as well as the value of the land at that time?)."
"TOTBALAMT",10,"Housing Costs",8,"Owner's Purchase, Value, and Debt",5,"2021 National, 2021 Metro, 2019 National, 2019 Metro, 2017 National, 2017 Metro, 2015 National, 2015 Metro","PUF","Total remaining debt across all mortgages or similar debts for this unit","HOUSEHOLD","Numeric","JTOTBALAMT","Coming soon","0 : 29999991: $0 to $29,999,991||29999992: $29,999,992 or more||M or -9: Not reported||N or -6: Not applicable","NA","NA","Noise","INTSTATUS = '1' and TENURE = '1' and MORTSTAT in ('2' '3' '4' '5')","TOTBALAMT is the sum of UNPBALAMT."
"YEARBUY",11,"Housing Costs",8,"Owner's Purchase, Value, and Debt",5,"2021 National, 2021 Metro, 2019 National, 2019 Metro, 2017 National, 2017 Metro, 2015 National, 2015 Metro","IUF Only","Year unit bought, obtained, or received","HOUSEHOLD","Numeric","JYEARBUY","Coming soon","1919 : 20XX: 1919 to 20XX||N or -6: Not applicable","When did you buy or take ownership of the unit?","WHNGET","Withheld","INTSTATUS = '1' and TENURE = '1'",
"AMMORT",1,"Mortgage Details",9,"Mortgage Origination",1,"2021 National, 2021 Metro","PUF","Initial amount borrowed or refinanced for the mortgage","MORTGAGE","Numeric","JAMMORT","Coming soon","1 : 9999997: $1 to $9,999,997||9999998: $9,999,998 or more||N or -6: Not applicable","How much was borrowed or refinanced for the mortgage or loan?","AMMORT","Noise","LOANTYPE in ('1' '2')",
"INTRATE",2,"Mortgage Details",9,"Mortgage Origination",1,"2021 National, 2021 Metro, 2019 National, 2019 Metro, 2017 National, 2017 Metro","PUF","Interest rate of mortgage","MORTGAGE","Numeric","JINTRATE","Coming soon","1 : 20.875: 1 to 20.875 percent","Looking at your statement, what is the current interest rate on the mortgage or loan?","INTW/F","Noise","LOANTYPE in ('1' '2' '3')",
"LOANTYPE",3,"Mortgage Details",9,"Mortgage Origination",1,"2021 National, 2021 Metro","PUF","Type of loan","MORTGAGE","Character","JLOANTYPE","Coming soon","1: Primary loan||2: Secondary loan||3: Home equity line of credit","See User Notes","See User Notes","None","INTSTATUS = '1' and TENURE = '1' and MORTSTAT in ('2' '3' '4' '5')","LOANTYPE is determined using MORTLINE (the order in which respondents reported their loans) and HELUMC (There are two types of home equity loans. With a home equity lump sum loan you receive the full amount borrowed up front. With a home equity line of credit you withdraw funds as needed up to a set limit. Is the mortgage or loan a home equity lump sum loan or a home equity line of credit?)"
"MORTADDTN",4,"Mortgage Details",9,"Mortgage Origination",1,"2021 National, 2021 Metro","PUF","Percentage of mortgage used for additions or improvements","MORTGAGE","Numeric","JMORTADDTN","Coming soon","0 : 100: 0 to 100 percent||M or -9: Not reported||N or -6: Not applicable","What percentage of this mortgage or loan was used for additions, improvements or repairs to the home?","ADDTNS","Noise","REFICSH = '1'",
"MORTCLASS",5,"Mortgage Details",9,"Mortgage Origination",1,"2021 National, 2021 Metro","PUF","Regular loan, lump sum loan, or line of credit","MORTGAGE","Character","JMORTCLASS","Coming soon","1: Regular loan||2: Home equity lump sum loan||3: Home equity line of credit","See User Notes","See User Notes","None","INTSTATUS = '1' and TENURE = '1' and MORTSTAT in ('2' '3' '4' '5')","MORTCLASS is determined using MGTYPE (Is the mortgage or loan a: Regular mortgage? Home equity loan or line of credit?), and HELUMC (Is the mortgage or loan a: Home equity lump sum loan? Home equity line of credit?)."
"MORTGOV",6,"Mortgage Details",9,"Mortgage Origination",1,"2021 National, 2021 Metro, 2019 National, 2019 Metro, 2017 National, 2017 Metro, 2015 National, 2015 Metro","IUF Only","Type of Federal Government mortgage insurance","MORTGAGE","Character","JMORTGOV","Coming soon","1: FHA||2: VA||3: Rural Housing Service / Rural Development||4: None of these||M or -9: Not reported||N or -6: Not applicable","Is the mortgage or loan an FHA, VA, Rural Housing Service/Rural Development mortgage, or none of these?","MORTIN","Withheld","LOANTYPE in ('1' '2')",
"MORTLINE",7,"Mortgage Details",9,"Mortgage Origination",1,"2021 National, 2021 Metro, 2019 National, 2019 Metro, 2017 National, 2017 Metro, 2015 National, 2015 Metro","PUF","Line number of mortgage","MORTGAGE","Numeric","JMORTLINE","Coming soon","1 : 7: 1 to 7","NA","NA","None","INTSTATUS = '1' and TENURE = '1' and MORTSTAT in ('2' '3' '4' '5')","The PUF includes the first three mortgages (values 1-3); the IUF includes all mortgages reported by the respondent (up to 7)."
"MORTTERM",8,"Mortgage Details",9,"Mortgage Origination",1,"2021 National, 2021 Metro","IUF Only","Term of mortgage","MORTGAGE","Numeric","JMORTTERM","Coming soon","1 : 40: 1 to 40 years||N or -6: Not applicable","From the date that you obtained or refinanced this mortgage or loan, how many years did you have to pay it off?","TERM","Withheld","LOANTYPE in ('1' '2') and MORTTERM > 0",
"MORTTYPE",9,"Mortgage Details",9,"Mortgage Origination",1,"2021 National, 2021 Metro","PUF","How payments vary over the length of the mortgage","MORTGAGE","Character","JMORTTYPE","Coming soon","1: Mortgage payment does not change||2: Mortgage payment changes||N or -6: Not applicable","See User Notes","See User Notes","Collapsed","INTSTATUS = '1' and TENURE = '1' and LOANTYPE in ('1' '2')","Respondents are first asked VARY (Are the payments on this mortgage or loan the same during the whole length of the mortgage or loan?), and if they reply no, then asked HOWVARY (Why do the payments in the mortgage or loan change?). Starting in 2015, HOWVARY's answer categories were randomized in the instrument."
"MORTTYPE_IUF",10,"Mortgage Details",9,"Mortgage Origination",1,"2021 National, 2021 Metro","IUF Only","How payments vary over the length of the mortgage","MORTGAGE","Character","JMORTTYPE_IUF","Coming soon","0: Mortgage payment does not change||1: Mortgage payment changes due to ""payment option""||2: Mortgage payment changes due to interest only, balance paid down later||3: Mortgages last payment the biggest (""balloon"" mortgage)||4: Mortgage payments vary according to set schedule (""graduated payment"")||5: Mortgage payment changes due to interest rate (""adjustable rate"")||6: Mortgage payment changes for taxes / insurance||7: Mortgage payment changes for other reason||M or -9: Not reported||N or -6: Not applicable","See User Notes","See User Notes","Withheld","INTSTATUS = '1' and TENURE = '1' and LOANTYPE in ('1' '2')","MORTTYPE_IUF is only present on the IUF. See User Notes for MORTTYPE."
"MORTYEAR",11,"Mortgage Details",9,"Mortgage Origination",1,"2021 National, 2021 Metro, 2019 National, 2019 Metro, 2017 National, 2017 Metro, 2015 National, 2015 Metro","IUF Only","Year mortgage obtained","MORTGAGE","Numeric","JMORTYEAR","Coming soon","1950 : 20XX: 1950 to 20XX","What year did you get or refinance the mortgage or loan?","YRMOR","Withheld","LOANTYPE in ('1' '2' '3')",
"INSPMT",1,"Mortgage Details",9,"Current Payment Details",2,"2021 National, 2021 Metro","IUF Only","Flag indicating homeowners insurance included in mortgage payment","MORTGAGE","Character","JINSPMT","Coming soon","1: Yes||2: No||M or -9: Not reported||N or -6: Not applicable","Is homeowner's insurance included in any of your mortgage or loan payment?","PMTINS","Withheld","LOANTYPE in ('1' '2')",
"MISCPMT",2,"Mortgage Details",9,"Current Payment Details",2,"2021 National, 2021 Metro","PUF","Flag indicating homeowners insurance or mortgage insurance (PMI) is included in the mortgage payment","MORTGAGE","Character","JMISCPMT","Coming soon","1: Yes||2: No","See User Notes","See User Notes","Collapsed","LOANTYPE in ( '1' '2' '3' )","MISCPMT is determined using PMTINS (Is homeowner's insurance included in your mortgage or loan payment?) and PMIPMT (Looking at your mortgage or loan, is Private Mortgage Insurance (PMI) currently included in your payment? Sometimes lenders require mortgage insurance if the down payment made by the home buyer is below a certain percentage.)."
"PMIPMT",3,"Mortgage Details",9,"Current Payment Details",2,"2021 National, 2021 Metro","IUF Only","Flag indicating private mortgage insurance included in mortgage payment","MORTGAGE","Character","JPMIPMT","Coming soon","1: Yes||2: No||M or -9: Not reported||N or -6: Not applicable","Looking at your mortgage or loan, is Private Mortgage Insurance (PMI) currently included in your payment? Sometimes lenders require mortgage insurance if the down payment made by the home buyer is below a certain percentage.","PMIPMT","Withheld","LOANTYPE in ('1' '2')",
"PMTAMT",4,"Mortgage Details",9,"Current Payment Details",2,"2021 National, 2021 Metro, 2019 National, 2019 Metro, 2017 National, 2017 Metro","PUF","Amount of mortgage payment","MORTGAGE","Numeric","JPMTAMT","Coming soon","1 : 99997: $1 to $99,997||99998: $99,998 or more||M or -9: Not reported||N or -6: Not applicable","Looking at your statement, how much is your current payment on the mortgage or loan?","PMT","Noise","HELOCBAL in ('1' 'N')",
"PMTFREQ",5,"Mortgage Details",9,"Current Payment Details",2,"2021 National, 2021 Metro","PUF","Frequency of mortgage payment","MORTGAGE","Character","JPMTFREQ","Coming soon","1: Once a month||2: Something else||M or -9: Not reported||N or -6: Not applicable","How often do you make a payment on your mortgage or loan?","PMTF","Collapsed","LOANTYPE in ('1' '2')",
"PMTFREQ_IUF",6,"Mortgage Details",9,"Current Payment Details",2,"2021 National, 2021 Metro","IUF Only","Frequency of mortgage payment","MORTGAGE","Character","JPMTFREQ_IUF","Coming soon","1: Once a month||2: Twice a month||3: Every two weeks||4: Something else||M or -9: Not reported||N or -6: Not applicable","How often do you make a payment on your mortgage or loan?","PMTF","Withheld","LOANTYPE in ('1' '2')","PMTFREQ_IUF is only present on the IUF."
"PMTONLY",7,"Mortgage Details",9,"Current Payment Details",2,"2021 National, 2021 Metro","PUF","Amount of mortgage payment paid towards principal and interest only","MORTGAGE","Numeric","JPMTONLY","Coming soon","1 : 99997: $1 to $99,997||99998: $99,998 or more||M or -9: Not reported||N or -6: Not applicable","NA","NA","Noise","LOANTYPE in ('1' '2') and MORTTERM > 0",
"TAXPMT",8,"Mortgage Details",9,"Current Payment Details",2,"2021 National, 2021 Metro","PUF","Flag indicating property taxes included in mortgage payment","MORTGAGE","Character","JTAXPMT","Coming soon","1: Yes||2: No||M or -9: Not reported||N or -6: Not applicable","Is property tax included in any of your mortgage or loan payments?","PMTTAX","None","LOANTYPE in ('1' '2')",
"UNPBALAMT",9,"Mortgage Details",9,"Current Payment Details",2,"2021 National, 2021 Metro","IUF Only","Amount currently owed on mortgage","MORTGAGE","Numeric","JUNPBALAMT","Coming soon","0 : 9999997: $0 to $9,999,997||9999998: $9,999,998 or more||M or -9: Not reported||N or -6: Not applicable","Looking at your statement, what is the amount that you currently owe on the mortgage or loan? That is, what is the unpaid principal balance?","UNPBAL","Withheld","LOANTYPE in ('1' '2' '3') and PMTAMT <> .N",
"REFI",1,"Mortgage Details",9,"Refinance",4,"2021 National, 2021 Metro","PUF","Flag indicating mortgage is a refinance of previous mortgage","MORTGAGE","Character","JREFI","Coming soon","1: Yes||2: No||M or -9: Not reported||N or -6: Not applicable","Is the mortgage or loan a refinanced mortgage?","REFI","None","MORTCLASS = '1'",
"REFICSH",2,"Mortgage Details",9,"Refinance",4,"2021 National, 2021 Metro","PUF","Flag indicating mortgage refinanced to receive cash or increase the outstanding balance of the loan","MORTGAGE","Character","JREFICSH","Coming soon","1: Yes||2: No||M or -9: Not reported||N or -6: Not applicable","Did you refinance this mortgage or loan to receive cash?","GTCASH","None","REFI = '1'",
"REFICSHAMT",3,"Mortgage Details",9,"Refinance",4,"2021 National, 2021 Metro","PUF","Amount of cash received from refinance","MORTGAGE","Numeric","JREFICSHAMT","Coming soon","1 : 999997: $1 to $999,997||999998: $999,998 or more||M or -9: Not reported||N or -6: Not applicable","When you refinanced for this mortgage or loan, how much cash did you receive?","CASH","Noise","REFICSH = '1'",
"HELOCADD",1,"Mortgage Details",9,"HELOC",5,"2021 National, 2021 Metro","PUF","Flag indicating home equity loan used for additions, improvements, or repairs","MORTGAGE","Character","JHELOCADD","Coming soon","1: Yes||2: No||M or -9: Not reported||N or -6: Not applicable","Did you use any of the funds from your mortgage or loan for additions, improvements, or repairs to this home?","IMPROV","None","LOANTYPE = '3'",
"HELOCBAL",2,"Mortgage Details",9,"HELOC",5,"2021 National, 2021 Metro","PUF","Flag indicating home equity loan has a current balance","MORTGAGE","Character","JHELOCBAL","Coming soon","1: Yes||2: No||N or -6: Not applicable","Do you currently have an outstanding balance against the mortgage or loan?","HEBAL","None","LOANTYPE = '3'",
"HELOCLIM",3,"Mortgage Details",9,"HELOC",5,"2021 National, 2021 Metro","PUF","Amount of credit limit on home equity loan","MORTGAGE","Numeric","JHELOCLIM","Coming soon","1 : 9999997: $1 to $9,999,997||9999998: $9,999,998 or more||M or -9: Not reported||N or -6: Not applicable","What is your total credit limit on the line of credit for the mortgage or loan?","HECR","Noise","LOANTYPE = '3'",
"HMRACCESS",1,"Home Improvement",10,"General",1,"2021 National, 2021 Metro, 2019 National, 2019 Metro","PUF","Flag indicating home improvements done in last two years to make home more accessible for those with physical limitations","HOUSEHOLD","Character","JHMRACCESS","Coming soon","1: Yes||2: No||M or -9: Not reported||N or -6: Not applicable","Did you do any of these home improvements to make your home more accessible for people with physical limitations, such as people using a wheelchair or a walker?","HMRACCESS","None","INTSTATUS = '1' and TENURE = '1' and REMODJOBS > 0",
"HMRENEFF",2,"Home Improvement",10,"General",1,"2021 National, 2021 Metro, 2019 National, 2019 Metro, 2017 National, 2017 Metro, 2015 National, 2015 Metro","PUF","Flag indicating home improvements done to make home more energy efficient in last two years","HOUSEHOLD","Character","JHMRENEFF","Coming soon","1: Yes||2: No||M or -9: Not reported||N or -6: Not applicable","Did you do any of these home improvements to improve energy efficiency?","HMRENEFF","None","INTSTATUS = '1' and TENURE = '1' and REMODJOBS > 0",
"HMRSALE",3,"Home Improvement",10,"General",1,"2021 National, 2021 Metro, 2019 National, 2019 Metro, 2017 National, 2017 Metro, 2015 National, 2015 Metro","PUF","Flag indicating home improvements done to get house ready for sale in last two years","HOUSEHOLD","Character","JHMRSALE","Coming soon","1: Yes||2: No||M or -9: Not reported||N or -6: Not applicable","Did you do any of these home improvements to get your house ready for sale?","HMRSALE","None","INTSTATUS = '1' and TENURE = '1' and REMODJOBS > 0",
"MAINTAMT",4,"Home Improvement",10,"General",1,"2021 National, 2021 Metro, 2019 National, 2019 Metro, 2017 National, 2017 Metro, 2015 National, 2015 Metro","PUF","Amount of annual routine maintenance costs","HOUSEHOLD","Numeric","JMAINTAMT","Coming soon","0 : 9997: $0 to $9,997||9998: $9,998 or more||M or -9: Not reported||N or -6: Not applicable","In a TYPICAL YEAR, about how much does your household spend for routine repairs and maintenance, such as painting, plumbing, roofing, or other minor repairs?","CSTMNT","Noise","INTSTATUS = '1' and TENURE = '1'",
"REMODAMT",5,"Home Improvement",10,"General",1,"2021 National, 2021 Metro, 2019 National, 2019 Metro, 2017 National, 2017 Metro, 2015 National, 2015 Metro","PUF","Total cost of home improvement jobs in last two years","HOUSEHOLD","Numeric","JREMODAMT","Coming soon","0 : 9999997: $0 to $9,999,997||9999998: $9,999,998 or more||N or -6: Not applicable","NA","NA","Topcoded","INTSTATUS = '1' and TENURE = '1'","REMODAMT=0 indicates that either the respondent did not report any home improvement jobs, or the respondent reported one or more home improvement jobs and all had a cost of $0."
"REMODJOBS",6,"Home Improvement",10,"General",1,"2021 National, 2021 Metro, 2019 National, 2019 Metro, 2017 National, 2017 Metro, 2015 National, 2015 Metro","PUF","Total number of home improvement jobs in last two years","HOUSEHOLD","Numeric","JREMODJOBS","Coming soon","0 : 41: 0 to 41 jobs||N or -6: Not applicable","NA","NA","None","INTSTATUS = '1' and TENURE = '1'",
"JOBCOMP",1,"Home Improvement",10,"Job Specific",2,"2021 National, 2021 Metro, 2019 National, 2019 Metro, 2017 National, 2017 Metro, 2015 National, 2015 Metro","PUF","Flag indicating if the home improvement job is complete","PROJECT","Character","JJOBCOMP","Coming soon","1: Yes||2: No||M or -9: Not reported","Is this job complete?","XXXXCMP","None","INTSTATUS = '1' and TENURE = '1'","XXXX represents the type of job (for example, FENCECMP)"
"JOBCOMPYR",2,"Home Improvement",10,"Job Specific",2,"2021 National, 2021 Metro, 2019 National, 2019 Metro, 2017 National, 2017 Metro, 2015 National, 2015 Metro","PUF","Year home improvement job was completed","PROJECT","Character","JJOBCOMPYR","Coming soon","1: (20XX - 2)||2: (20XX - 1)||3: 20XX||M or -9: Not reported||N or -6: Not applicable","Was it completed in ____, ____, or ____.","XXXXYR","None","INTSTATUS = '1' and TENURE = '1' and JOBCOMP = '1'","In the Response Codes, 20XX is the year the survey was conducted. For example, in the 2017 survey, Response Code 1 = (20XX - 2) = (2017 - 2) = 2015. In the Instrument Variable Name, XXXXYR, XXXX indicates the type of home improvement job."
"JOBCOST",3,"Home Improvement",10,"Job Specific",2,"2021 National, 2021 Metro, 2019 National, 2019 Metro, 2017 National, 2017 Metro, 2015 National, 2015 Metro","PUF","Cost of home improvement job","PROJECT","Numeric","JJOBCOST","Coming soon","0 : 999997: $0 to $999,997||999998: $999,998 or more","How much did the entire XXXX job cost, including your costs and any amount covered by insurance, not counting your time?","XXXXAM","Rounded/Topcoded","INTSTATUS = '1' and TENURE = '1'","XXXX represents the type of job (for example, FENCEAM)"
"JOBDIY",4,"Home Improvement",10,"Job Specific",2,"2021 National, 2021 Metro, 2019 National, 2019 Metro, 2017 National, 2017 Metro, 2015 National, 2015 Metro","PUF","Flag indicating job was do-it-yourself","PROJECT","Character","JJOBDIY","Coming soon","1: Yes||2: No","Did someone in your household do most of the work?","XXXXWK","None","INTSTATUS = '1' and TENURE = '1'","XXXX represents the type of job (for example, FENCEWK)"
"JOBFUNDS",5,"Home Improvement",10,"Job Specific",2,"2021 National, 2021 Metro, 2019 National, 2019 Metro, 2017 National, 2017 Metro, 2015 National, 2015 Metro","PUF","Main source of funding for home improvement job","PROJECT","Character","JJOBFUNDS","Coming soon","1: Cash from savings||2: Cash from refinancing home||3: A home equity loan||4: Homeowner's insurance settlement||5: Credit card or retail store charge card||6: Contractor arranged financing||7: Other||M or -9: Not reported","What was the main source of funding for this job?","XXXXFIN","None","INTSTATUS = '1' and TENURE = '1'","XXXX represents the type of job (for example, FENCEFIN)"
