"Variable","Variable Number","Topic","Topic Number","Subtopic","Subtopic Number","Survey Years","Availability","Description","Table Name","Type","Edit Flag Variable","Imputation Strategy","Response Codes","Question Text","Instrument Variable Name(s)","Disclosure","Conditions in Universe","User Notes"
"CONTROL",1,"Admin",1,"Interview Status",1,"2021 National","PUF","Control number","ALL","Character","NA","Coming soon","000000000001 : 999999999999: 000000000001 to 999999999999","NA","NA","None","INTSTATUS in ('1' '2' '3')","CONTROL is sequentially assigned each survey year. Beginning with 2015, the first three digits are 110 for National sample records, and 210 for Metropolitan sample records. The last five digits are sequentially numbered beginning with 00001. CONTROL can be used to link records across datasets and between survey years."
"CONTROL",1,"Admin",1,"Interview Status",1,"2021 Metro","PUF","Control number","ALL","Character","NA","Coming soon","10000001 : 99999999: 10000001 to 99999999","NA","NA","None","INTSTATUS in ('1' '2' '3')","CONTROL is sequentially assigned each survey year. Beginning with 2015, the first three digits are 110 for National sample records, and 210 for Metropolitan sample records. The last five digits are sequentially numbered beginning with 00001. CONTROL can be used to link records across datasets and between survey years."
"INTLANG",2,"Admin",1,"Interview Status",1,"2021 National, 2021 Metro, 2019 National, 2019 Metro","PUF","Interview language","HOUSEHOLD","Character","NA","Coming soon","01: English||02: Spanish||10: Other||M or -9: Not reported","In what language was the interview conducted?","LANG","None","INTSTATUS in ('1' '2' '3')","This question is not asked of the respondent. The Field Representative provided the language information as the interview was being completed. This information is recorded for all Occupied, Vacant, and URE interviews."
"INTMODE",3,"Admin",1,"Interview Status",1,"2021 National, 2021 Metro, 2019 National, 2019 Metro, 2017 National, 2017 Metro, 2015 National, 2015 Metro","PUF","Interview mode","HOUSEHOLD","Character","NA","Coming soon","1: Telephone interview||2: Personal visit||M or -9: Not reported","NA","NA","None","INTSTATUS in ('1' '2' '3')","Interview mode is determined using information provided by the Field Representative."
"INTMONTH",4,"Admin",1,"Interview Status",1,"2021 National, 2021 Metro, 2019 National, 2019 Metro","PUF","Interview month","HOUSEHOLD","Character","NA","Coming soon","01: January||02: February||03: March||04: April||05: May||06: June||07: July||08: August||09: September||10: October||11: November||12: December","NA","NA","None","INTSTATUS in ('1' '2' '3')","Interview month is determined using the instrument (laptop) date stamp for the interview. If the respondent was interviewed in more than one month (for example, a follow-up visit was needed to complete the interview), INTMONTH reflects the last contact."
"INTSTATUS",5,"Admin",1,"Interview Status",1,"2021 National, 2021 Metro, 2019 National, 2019 Metro, 2017 National, 2017 Metro, 2015 National, 2015 Metro","PUF","Interview status","HOUSEHOLD","Character","NA","Coming soon","1: Occupied interview||2: URE (Usual Residence Elsewhere) interview||3: Vacant interview","NA","NA","None","INTSTATUS in ('1' '2' '3')","Interview status is determined using information provided by the Field Representative."
"BLOCK_2010",1,"Admin",1,"Geography",2,"2021 National, 2021 Metro, 2019 National, 2019 Metro, 2017 National, 2017 Metro, 2015 National, 2015 Metro","IUF Only","2010 Census block code","HOUSEHOLD","Character","NA","Coming soon","1000 : 9999: 1000 to 9999","NA","NA","Withheld","INTSTATUS in ('1' '2' '3')",
"COUNTY_2010",2,"Admin",1,"Geography",2,"2021 National, 2021 Metro","IUF Only","2010 Census county FIPS code","HOUSEHOLD","Character","NA","Coming soon","001 : 840: 001 to 840","NA","NA","Withheld","INTSTATUS in ('1' '2' '3')","These values adhere to the Federal Information Processing Standards (FIPS) three digit county codes for 2010. More information on these codes can be found at https://www.census.gov/programs-surveys/popest/geographies/reference-files.html."
"DEGREE",3,"Admin",1,"Geography",2,"2021 National, 2021 Metro, 2019 National, 2019 Metro, 2017 National, 2017 Metro, 2015 National, 2015 Metro","IUF Only","Average heating / cooling degree days","HOUSEHOLD","Character","NA","Coming soon","1: Coldest: 7,001 or more heating degree days and less than 2,000 cooling degree days||2: Cold: 5,500 to 7,000 heating degree days and less than 2,000 cooling degree days||3: Cool: 4,000 to 5,499 heating degree days and less than 2,000 cooling degree days||4: Mild: less than 4,000 heating degree days and less than 2,000 cooling degree days||5: Mixed: 2,000 to 3,999 heating degree days and 2,000 or more cooling degree days||6: Hot: less than 2,000 heating degree days and 2,000 or more cooling degree days","NA","NA","Withheld","INTSTATUS in ('1' '2' '3')",
"DIVISION",4,"Admin",1,"Geography",2,"2021 National, 2021 Metro, 2019 National, 2019 Metro, 2017 National, 2017 Metro, 2015 National, 2015 Metro","PUF","Census division","HOUSEHOLD","Character","NA","Coming soon","1: New England||2: Middle Atlantic||3: East North Central||4: West North Central||5: South Atlantic||6: East South Central||7: West South Central||8: Mountain||9: Pacific","NA","NA","None","INTSTATUS in ('1' '2' '3')","DIVISION appears on the National PUF only. The Metro IUF, not the PUF, includes DIVISION (due to disclosure reasons)."
"LAT",5,"Admin",1,"Geography",2,"2021 National, 2021 Metro, 2019 National, 2019 Metro, 2017 National, 2017 Metro, 2015 National, 2015 Metro","IUF Only","Latitude","HOUSEHOLD","Character","JLAT","Coming soon","Blank","NA","NA","Withheld","INTSTATUS in ('1' '2' '3')",
"LON",6,"Admin",1,"Geography",2,"2021 National, 2021 Metro, 2019 National, 2019 Metro, 2017 National, 2017 Metro, 2015 National, 2015 Metro","IUF Only","Longitude","HOUSEHOLD","Character","JLON","Coming soon","Blank","NA","NA","Withheld","INTSTATUS in ('1' '2' '3')",
"METRO_2013",7,"Admin",1,"Geography",2,"2021 National, 2021 Metro, 2019 National, 2019 Metro, 2017 National, 2017 Metro, 2015 National, 2015 Metro","IUF Only","2013 metropolitan area type","HOUSEHOLD","Character","NA","Coming soon","1: Metro: Central City||2: Metro: Non-Central City||3: Micropolitan Area||4: Non-Micropolitan Area","NA","NA","Withheld","INTSTATUS in ('1' '2' '3')","This item uses Office of Management and Budget (OMB) definitions for 2013 metro areas and their principal cities. More information on these definitions can be found at https://www.census.gov/programs-surveys/metro-micro.html."
"OMB13CBSA",8,"Admin",1,"Geography",2,"2021 National, 2021 Metro, 2019 National, 2019 Metro","PUF","2013 OMB CBSA code","HOUSEHOLD","Character","NA","Coming soon","12060: Atlanta-Sandy Springs-Roswell, GA||12580: Baltimore-Columbia-Towson, MD||13820: Birmingham-Hoover, AL||14460: Boston-Cambridge-Newton, MA-NH||16980: Chicago-Naperville-Elgin, IL-IN-WI||17140: Cincinnati, OH-KY-IN||17460: Cleveland-Elyria, OH||19100: Dallas-Fort Worth-Arlington, TX||19740: Denver-Aurora-Lakewood, CO||19820: Detroit-Warren-Dearborn, MI||26420: Houston-The Woodlands-Sugar Land, TX||28140: Kansas City, MO-KS||29820: Las Vegas-Henderson-Paradise, NV||31080: Los Angeles-Long Beach-Anaheim, CA||32820: Memphis, TN-MS-AR||33100: Miami-Fort Lauderdale-West Palm Beach, FL||33340: Milwaukee-Waukesha-West Allis, WI||33460: Minneapolis-St. Paul-Bloomington, MN-WI||35380: New Orleans-Metairie, LA||35620: New York-Newark-Jersey City, NY-NJ-PA||36420: Oklahoma City, OK||37980: Philadelphia-Camden-Wilmington, PA-NJ-DE-MD||38060: Phoenix-Mesa-Scottsdale, AZ||38300: Pittsburgh, PA||38900: Portland-Vancouver-Hillsboro, OR-WA||39580: Raleigh, NC||40060: Richmond, VA||40140: Riverside-San Bernardino-Ontario, CA||40380: Rochester, NY||41700: San Antonio-New Braunfels, TX||41860: San Francisco-Oakland-Hayward, CA||41940: San Jose-Sunnyvale-Santa Clara, CA||42660: Seattle-Tacoma-Bellevue, WA||45300: Tampa-St. Petersburg-Clearwater, FL||47900: Washington-Arlington-Alexandria, DC-VA-MD-WV||99998: All other metropolitan areas||99999: Not in a metropolitan area","NA","NA","None","INTSTATUS in ('1' '2' '3')","These values adhere to the Office of Management and Budget (OMB) definitions for Core Based Statistical Areas (CBSAs). More information on these can be found at https://www.census.gov/programs-surveys/metro-micro.html. OMB13CBSA codes are only produced for cases in the 15 largest metropolitan areas (on the National microdata) and cases on the Metropolitan microdata files."
"OMB13CBSA_IUF",9,"Admin",1,"Geography",2,"2021 National, 2021 Metro, 2019 National, 2019 Metro","IUF Only","2013 OMB CBSA code","HOUSEHOLD","Character","NA","Coming soon","10100 : 49820: 10100 to 49820","NA","NA","Withheld","INTSTATUS in ('1' '2' '3')","OMB13CBSA indicates the Core Based Statistical Area (CBSA) code at the time the case was selected for the AHS sample. In rare instances, the geocoding may be corrected after the case has been selected. When this happens, the OMB13CBSA_IUF variable will reflect the updated location. Additionally, while the PUF only shows CBSA codes for areas which AHS publishes, the IUF shows CBSA codes for all cases located in any CBSA. Internal users should continue to use OMB13CBSA to produce any tabulations for public release. Also see OMB13CBSA."
"PUMA_2010",10,"Admin",1,"Geography",2,"2021 National, 2021 Metro, 2019 National, 2019 Metro, 2017 National, 2017 Metro, 2015 National, 2015 Metro","IUF Only","2010 Census Public Use Microdata Area code","HOUSEHOLD","Character","NA","Coming soon","00100 : 70301: 00100 to 70301","NA","NA","Withheld","INTSTATUS in ('1' '2' '3')","This item uses the Census defined 2010 Public Use Microdata Areas (PUMAs), which are geographic units comprised of Census tracts covering areas with populations greater than 100,000. More information on these definitions can be found at https://www.census.gov/geographies/reference-files/time-series/geo/relationship-files.html."
"RUCA_2010",11,"Admin",1,"Geography",2,"2021 National, 2021 Metro, 2019 National, 2019 Metro, 2017 National, 2017 Metro, 2015 National, 2015 Metro","IUF Only","2010 Rural-Urban Commuting Areas code","HOUSEHOLD","Numeric","NA","Coming soon","1: Metropolitan area core: primary flow within an urbanized area (UA)||2: Metropolitan area high commuting: primary flow 30% or more to a UA||3: Metropolitan area low commuting: primary flow 10% to 30% to a UA||4: Metropolitan area core: primary flow within an Urban Cluster of 10,000 to 49,999 (large UC)||5: Metropolitan high commuting: primary flow 30% or more to a large UC||6: Metropolitan low commuting: primary flow 10% to 30% to a large UC||7: Small town core: primary flow within an Urban Cluster of 2,500 to 9,999 (small UC)||8: Small town high commuting: primary flow 30% or more to a small UC||9: Small town low commuting: primary flow 10% to 30% to a small UC||10: Rural areas: primary flow to a tract outside a UA or UC||99: Not coded: Census tract has zero population and no rural-urban identifier information","NA","NA","Withheld","INTSTATUS in ('1' '2' '3')","This item uses Rural-Urban Commuting Area codes defined by the Department of Agriculture. More information on these definitions can be found at http://www.ers.usda.gov/data-products/rural-urban-commuting-area-codes.aspx."
"RUCC_2013",12,"Admin",1,"Geography",2,"2021 National, 2021 Metro, 2019 National, 2019 Metro, 2017 National, 2017 Metro, 2015 National, 2015 Metro","IUF Only","2013 Rural-Urban Continuum Codes","HOUSEHOLD","Numeric","NA","Coming soon","1: Counties in metro areas of 1 million population or more||2: Counties in metro areas of 250,000 to 1 million population||3: Counties in metro areas of fewer than 250,000 population||4: Urban population of 20,000 or more, adjacent to a metro area||5: Urban population of 20,000 or more, not adjacent to a metro area||6: Urban population of 2,500 to 19,999, adjacent to a metro area||7: Urban population of 2,500 to 19,999, not adjacent to a metro area||8: Completely rural or less than 2,500 urban population, adjacent to a metro area||9: Completely rural or less than 2,500 urban population, not adjacent to a metro area","NA","NA","Withheld","INTSTATUS in ('1' '2' '3')","This item uses Rural-Urban Continuum Codes defined by the Department of Agriculture. More information on these definitions can be found at http://www.ers.usda.gov/data-products/rural-urban-continuum-codes.aspx."
"STATE",13,"Admin",1,"Geography",2,"2021 National, 2021 Metro, 2019 National, 2019 Metro, 2017 National, 2015 National, 2015 Metro","IUF Only","State FIPS code","HOUSEHOLD","Character","NA","Coming soon","01: Alabama||02: Alaska||04: Arizona||05: Arkansas||06: California||08: Colorado||09: Connecticut||10: Delaware||11: District of Columbia||12: Florida||13: Georgia||15: Hawaii||16: Idaho||17: Illinois||18: Indiana||19: Iowa||20: Kansas||21: Kentucky||22: Louisiana||23: Maine||24: Maryland||25: Massachusetts||26: Michigan||27: Minnesota||28: Mississippi||29: Missouri||30: Montana||31: Nebraska||32: Nevada||33: New Hampshire||34: New Jersey||35: New Mexico||36: New York||37: North Carolina||38: North Dakota||39: Ohio||40: Oklahoma||41: Oregon||42: Pennsylvania||44: Rhode Island||45: South Carolina||46: South Dakota||47: Tennessee||48: Texas||49: Utah||50: Vermont||51: Virginia||53: Washington||54: West Virginia||55: Wisconsin||56: Wyoming||99: Suppressed","NA","NA","Withheld","INTSTATUS in ('1' '2' '3')","These values adhere to the Federal Information Processing Standards (FIPS) two digit state codes. More information on these codes can be found at https://www.census.gov/programs-surveys/popest/geographies/reference-files.html."
"TRACT_2010",14,"Admin",1,"Geography",2,"2021 National, 2021 Metro, 2019 National, 2019 Metro, 2017 National, 2017 Metro, 2015 National, 2015 Metro","IUF Only","2010 Census tract code","HOUSEHOLD","Character","NA","Coming soon","000100 : 999999: 000100 to 999999","NA","NA","Withheld","INTSTATUS in ('1' '2' '3')","TRACT uses the tract boundary definitions from the 2010 Census and should be used when matching to 2010 decennial tract level files."
"TRACT_2021",15,"Admin",1,"Geography",2,"2021 National, 2021 Metro","IUF Only","2021 Census tract code","HOUSEHOLD","Character","NA","Coming soon","000100 : 999999: 000100 to 999999","NA","NA","Withheld","INTSTATUS in ('1' '2' '3')","TRACT_2021 incorporates tract re-numbering that took place between 2015 and 2021 and should be used to match to tract estimates from other surveys of 2021 data (the most common example being the 2021 ACS tract level estimates)."
"URBAN_2010",16,"Admin",1,"Geography",2,"2021 National, 2021 Metro, 2019 National, 2019 Metro, 2017 National, 2017 Metro, 2015 National, 2015 Metro","IUF Only","2010 urban area type","HOUSEHOLD","Character","NA","Coming soon","1: Urbanized Area||2: Urban Cluster||3: Rural","NA","NA","Withheld","INTSTATUS in ('1' '2' '3')","This item refers to Census defined 2010 urban areas. More information on these definitions can be found at https://www.census.gov/programs-surveys/geography/about/faq/2010-urban-area-faq.html."
"XYMETHOD",17,"Admin",1,"Geography",2,"2021 National, 2021 Metro, 2019 National, 2019 Metro","IUF Only","Flag indicating latitude and longitude assignment method","HOUSEHOLD","Character","NA","Coming soon","A: Address||BL: Block estimate||E: eLot estimate||M: MAF||MS: MAF using survivor MAFID||P: Lat / Lon from parcel file||PE: Lat / Lon estimate from parcel file||Z4: Zip 4 imputation||Z5: Zip 5 imputation","NA","NA","Withheld","INTSTATUS in ('1' '2' '3')",
"REPWEIGHTXXX",1,"Admin",1,"Weighting",3,"2021 National, 2021 Metro, 2019 National, 2019 Metro, 2017 National, 2017 Metro, 2015 National, 2015 Metro","PUF","Replicate weight (XXX represents 1 - 160)","HOUSEHOLD","Numeric","NA","Coming soon","0 : 99999: 0 to 99,999","NA","NA","None","INTSTATUS in ('1' '2' '3')","More information on using replicate weights can be found at https://www.census.gov/programs-surveys/ahs/tech-documentation/help-guides.html."
"SP1REPWGTXXX",2,"Admin",1,"Weighting",3,"2021 National, 2021 Metro, 2019 National, 2019 Metro, 2017 National, 2017 Metro, 2015 National, 2015 Metro","PUF","Replicate weight for split sample: group 1 topical modules (XXX represents 1 - 160)","HOUSEHOLD","Numeric","NA","Coming soon","0 : 99999: 0 to 99,999","NA","NA","None","INTSTATUS in ('1' '2' '3') and SPLITSAMP = '1'","More information on using replicate weights can be found at https://www.census.gov/programs-surveys/ahs/tech-documentation/help-guides.html."
"SP1WEIGHT",3,"Admin",1,"Weighting",3,"2021 National, 2021 Metro","PUF","Final weight for split sample: group 1 topical modules","HOUSEHOLD","Numeric","NA","Coming soon","0 : 99999: 0 to 99,999","NA","NA","None","INTSTATUS in ('1' '2' '3') and SPLITSAMP = '1'","Some AHS modules are considered to be ""topical"" as opposed to ""core."" Topical modules are included on a rotating basis and are usually asked of only half the AHS sample. When a topical module is only asked of half the sample a special weight is provided that must be used for estimating those data items. SP1WEIGHT is only present for records that are in group 1; SP2WEIGHT is only present for records in group 2. <br/> In 2021, Group 1 included the topic Recent Mover and Neighborhood Quality; Group 2 included Pets, Wildfire Risk, Smokers. <br/> In 2019, Group 1 included the topic Food Security and Post-Secondary Education; Group 2 included Accessibility. <br/> In 2017, Group 1 included the topic Commuting; Group 2 included Disaster Planning. <br/> In 2015, Group 1 included the topics Art, Food Security, and Housing Counseling; Group 2 included Healthy Homes."
"SP2REPWGTXXX",4,"Admin",1,"Weighting",3,"2021 National, 2021 Metro, 2019 National, 2019 Metro, 2017 National, 2017 Metro, 2015 National, 2015 Metro","PUF","Replicate weight for split sample: group 2 topical modules (XXX represents 1 - 160)","HOUSEHOLD","Numeric","NA","Coming soon","0 : 99999: 0 to 99,999","NA","NA","None","INTSTATUS in ('1' '2' '3') and SPLITSAMP = '2'","More information on using replicate weights can be found at https://www.census.gov/programs-surveys/ahs/tech-documentation/help-guides.html."
"SP2WEIGHT",5,"Admin",1,"Weighting",3,"2021 National, 2021 Metro","PUF","Final weight for split sample: group 2 topical modules","HOUSEHOLD","Numeric","NA","Coming soon","0 : 99999: 0 to 99,999","NA","NA","None","INTSTATUS in ('1' '2' '3') and SPLITSAMP = '2'","Some AHS modules are considered to be ""topical"" as opposed to ""core."" Topical modules are included on a rotating basis and are usually asked of only half the AHS sample. When a topical module is only asked of half the sample a special weight is provided that must be used for estimating those data items. SP1WEIGHT is only present for records that are in group 1; SP2WEIGHT is only present for records in group 2. <br/> In 2021, Group 1 included the topic Recent Mover and Neighborhood Quality; Group 2 included Pets, Wildfire Risk, Smokers. <br/> In 2019, Group 1 included the topic Food Security and Post-Secondary Education; Group 2 included Accessibility. <br/> In 2017, Group 1 included the topic Commuting; Group 2 included Disaster Planning. <br/> In 2015, Group 1 included the topics Art, Food Security, and Housing Counseling; Group 2 included Healthy Homes."
"SPLITSAMP",6,"Admin",1,"Weighting",3,"2021 National, 2021 Metro","PUF","Flag indicating split sample group","HOUSEHOLD","Character","NA","Coming soon","1: Group 1||2: Group 2","NA","NA","None","INTSTATUS in ('1' '2' '3')","Some AHS modules are considered to be ""topical"" as opposed to ""core."" Topical modules are included on a rotating basis and are usually asked of only half the AHS sample. When a topical module is only asked of half the sample a split sample flag is assigned to designate group 1 or 2. <br/> In 2021, Group 1 included the topic Recent Mover and Neighborhood Quality; Group 2 included Pets, Wildfire Risk, Smokers. <br/> In 2019, Group 1 included the topic Food Security and Post-Secondary Education; Group 2 included Accessibility. <br/> In 2017, Group 1 included the topic Commuting; Group 2 included Disaster Planning. <br/> In 2015, Group 1 included the topics Art, Food Security, and Housing Counseling; Group 2 included Healthy Homes."
"STATEREPWGTXXX",7,"Admin",1,"Weighting",3,"2021 National, 2021 Metro, 2019 National, 2019 Metro, 2017 National, 2017 Metro, 2015 National, 2015 Metro","IUF Only","Replicate weight for state estimates (XXX represents 1 - 160)","HOUSEHOLD","Numeric","NA","Coming soon","0 : 99999: 0 to 99,999||M or -9: State replicate weights not available","NA","NA","Withheld","INTSTATUS in ('1' '2' '3')","More information on using replicate weights can be found at https://www.census.gov/programs-surveys/ahs/tech-documentation/help-guides.html."
"STATEWGT",8,"Admin",1,"Weighting",3,"2021 National, 2021 Metro","IUF Only","Final weight for state estimates","HOUSEHOLD","Numeric","NA","Coming soon","0 : 99999: 0 to 99,999||M or -9: State weight not available","NA","NA","Withheld","INTSTATUS in ('1' '2' '3')","Use STATEWGT when producing state-level estimates. Note that STATEWGT is the same as WEIGHT for the following states: CA, TX, FL, NY, PA. These five states will be available every survey year; selected states will also be available in each year (for core estimates, not topical modules). For 2015, the following states are also available: CO, OH. For 2017, the following states are also available: IL, MA, MD, VA. For 2019, the following states are also available: CO, IL, MA, OH."
"WEIGHT",9,"Admin",1,"Weighting",3,"2021 National, 2021 Metro, 2019 National, 2019 Metro","PUF","Final weight","HOUSEHOLD","Numeric","NA","Coming soon","0 : 99999: 0 to 99,999","Final weight","NA","None","INTSTATUS in ('1' '2' '3')","Each housing unit in the AHS represents itself and a number of other units. In order to develop estimates using the AHS the final weight must be applied to the survey data. The final weight starts with the inverse of the sampling fraction (PWT) and incorporates several adjustment factors that minimize sampling errors and errors from incomplete survey data. <br/> <br/> The Noninterview Adjustment Factor increases the weight of each interviewed unit to account for sampled units that were not interviewed. This adjustment is applied to five classes of geography: central cities, urban and rural inside MSAs, urban and rural outside MSAs. Over time the geographic boundaries related to these five classes may be redefined by local or state governments. For National surveys, WEIGHT uses the boundaries as they were officially defined in 1980. For Metro surveys, WEIGHT uses the boundaries as they were defined in the decennial year prior to the survey year. <br/> <br/> More information on weighting can be found at www.census.gov/programs-surveys/ahs/tech-documentation/def-errors-changes.html. <br/> <br/> WEIGHT may be used with all Metro surveys, and for National survey years 1997, 1999, and 2015 and later. For National survey years 2001 to 2013, WGT90GEO should be used as the final weight."
"JXXXXX",1,"Admin",1,"Edit Variables",4,"2021 National, 2021 Metro, 2019 National, 2019 Metro, 2017 National, 2017 Metro, 2015 National, 2015 Metro","PUF","Edit flag for XXXXX (where (XXXXX represents the name of the variable)","ALL","Character","NA","Coming soon","0: No change||1: Changed by edit||2: Changed by imputation||3: Changed by both edit and imputation","NA","NA","None","INTSTATUS in ('1' '2' '3')","JXXXXX is found in the same relational table as XXXXX and appears in the same survey years as XXXXX."
"COMPLEX",1,"Occupancy and Tenure",2,"Tenure",1,"2021 National, 2021 Metro, 2019 National, 2019 Metro, 2017 National, 2017 Metro, 2015 National, 2015 Metro","IUF Only","Flag indicating this building is part of an apartment complex","HOUSEHOLD","Character","JCOMPLEX","Coming soon","1: Yes||2: No||M or -9: Not reported||N or -6: Not applicable","Some apartment buildings are part of a complex of multiple apartment buildings. Is this building part of a complex?","COMPLEX","Withheld","INTSTATUS = '1' and BLD in ('04' '05' '06' '07' '08' '09')",
"CONDO",2,"Occupancy and Tenure",2,"Tenure",1,"2021 National, 2021 Metro, 2019 National, 2019 Metro","PUF","Flag indicating unit is a condominium","HOUSEHOLD","Character","JCONDO","Coming soon","1: Yes||2: No","Is this unit part of a condominium?","CONDO1","None","INTSTATUS in ('1' '2' '3')","The coding for this variable changed in 2015. It is now simply a flag indicating if the unit is a condo. The variable COOP now captures the same information for cooperatives."
"COOP",3,"Occupancy and Tenure",2,"Tenure",1,"2021 National, 2021 Metro, 2019 National, 2019 Metro, 2017 National, 2017 Metro, 2015 National, 2015 Metro","IUF Only","Flag indicating unit is a cooperative","HOUSEHOLD","Character","JCOOP","Coming soon","1: Yes||2: No","Is this unit part of a cooperative?","CONDO2","Withheld","INTSTATUS in ('1' '2' '3')",
"HOA",4,"Occupancy and Tenure",2,"Tenure",1,"2021 National, 2021 Metro","PUF","Flag indicating unit is part of a homeowner's association","HOUSEHOLD","Character","JHOA","Coming soon","1: Yes||2: No||M or -9: Not reported","Is this unit part of a homeowner association?","HOMEASC","None","INTSTATUS in ('1' '2' '3')","Starting in 2021, this question was also asked of renters."
