"Variable","Variable Number","Topic","Topic Number","Subtopic","Subtopic Number","Survey Years","Availability","Description","Table Name","Type","Edit Flag Variable","Imputation Strategy","Response Codes","Question Text","Instrument Variable Name(s)","Disclosure","Conditions in Universe","User Notes"
"NATVTY",24,"Demographics",6,"Person Demographics",5,"2021 National, 2021 Metro, 2019 National, 2019 Metro, 2017 National, 2017 Metro, 2015 National, 2015 Metro","PUF","Country of birth of person","PERSON","Character","JNATVTY","Coming soon","057: United States||060: American Samoa||066: Guam||069: Northern Marianas||073: Puerto Rico||078: U.S. Virgin Islands||100: Albania||102: Austria||103: Belgium||104: Bulgaria||105: Czechoslovakia||106: Denmark||108: Finland||109: France||110: Germany||116: Greece||117: Hungary||119: Ireland||120: Italy||126: Netherlands||127: Norway||128: Poland||129: Portugal||130: Azores||132: Romania||134: Spain||136: Sweden||137: Switzerland||138: United Kingdom||139: England||140: Scotland||142: Northern Ireland||147: Yugoslavia||148: Czech Republic||149: Slovakia||150: Bosnia and Herzegovina||151: Croatia||152: Macedonia||154: Serbia||155: Estonia||156: Latvia||157: Lithuania||158: Armenia||159: Azerbaijan||160: Belarus||161: Georgia||162: Moldova||163: Russia||164: Ukraine||165: USSR||166: Europe, not specified||168: Montenegro||200: Afghanistan||202: Bangladesh||203: Bhutan||205: Myanmar (Burma)||206: Cambodia||207: China||209: Hong Kong||210: India||211: Indonesia||212: Iran||213: Iraq||214: Israel||215: Japan||216: Jordan||217: Korea||218: Kazakhstan||220: South Korea||222: Kuwait||223: Laos||224: Lebanon||226: Malaysia||228: Mongolia||229: Nepal||231: Pakistan||233: Philippines||235: Saudi Arabia||236: Singapore||238: Sri Lanka||239: Syria||240: Taiwan||242: Thailand||243: Turkey||245: United Arab Emirates||246: Uzbekistan||247: Vietnam||248: Yemen||249: Asia, not specified||300: Bermuda||301: Canada||303: Mexico||310: Belize||311: Costa Rica||312: El Salvador||313: Guatemala||314: Honduras||315: Nicaragua||316: Panama||321: Antigua and Barbuda||323: Bahamas||324: Barbados||327: Cuba||328: Dominica||329: Dominican Republic||330: Grenada||332: Haiti||333: Jamaica||338: St. Kitts-Nevis||339: St. Lucia||340: St. Vincent and the Grenadines||341: Trinidad and Tobago||343: West Indies, not specified||360: Argentina||361: Bolivia||362: Brazil||363: Chile||364: Columbia||365: Ecuador||368: Guyana||369: Paraguay||370: Peru||372: Uruguay||373: Venezuela||374: South America, not specified||399: Americas, not specified||400: Algeria||407: Cameroon||408: Cape Verde||412: Congo||414: Egypt||416: Ethiopia||417: Eritrea||421: Ghana||423: Guinea||425: Ivory Coast||427: Kenya||429: Liberia||430: Libya||436: Morocco||440: Nigeria||444: Senegal||447: Sierra Leone||448: Somalia||449: South Africa||451: Sudan||453: Tanzania||454: Togo||457: Uganda||459: Zaire||460: Zambia||461: Zimbabwe||462: Africa, not specified||501: Australia||508: Fiji||511: Marshall Islands||512: Micronesia||515: New Zealand||523: Tonga||527: Samoa||555: Elsewhere","In what country were you born?","NATVTYCOU","Collapsed","INTSTATUS = '1'",
"PDTHSP",25,"Demographics",6,"Person Demographics",5,"2021 National, 2021 Metro, 2019 National, 2019 Metro","PUF","Detailed Spanish origin of person","PERSON","Character","JPDTHSP","Coming soon","1: Mexican||2: Puerto Rican||3: Cuban||4: Dominican||5: Salvadoran||6: Central American (excl. Salvadoran)||7: South American||8: Other Hispanic||N: Not applicable","What is the name of his or her other Spanish, Hispanic, or Latino group?","OROTSP","None","INTSTATUS = '1' and SPAN = '1'",
"PERSONID",26,"Demographics",6,"Person Demographics",5,"2021 National, 2021 Metro, 2019 National, 2019 Metro, 2017 National, 2017 Metro, 2015 National, 2015 Metro","PUF","Person identifier","PERSON","Character","NA","Coming soon","10000001001 : 21099999999: 10000001001 to 21099999999","NA","NA","None","INTSTATUS = '1'","PERSONID is an 11-digit variable that serves as a unique identifier for each household member on the Person dataset. The variable is created by concatenating the CONTROL number with a 3-digit, zero-padded person integer, starting with '001' and incrementing by one for each additional person in the housing unit. The PERSONID value for each person will remain the same across survey years."
"PLINE",27,"Demographics",6,"Person Demographics",5,"2021 National, 2021 Metro, 2019 National, 2019 Metro, 2017 National, 2017 Metro, 2015 National, 2015 Metro","PUF","Line number of person","PERSON","Numeric","NA","Coming soon","1 : 30: 1 to 30","NA","NA","None","INTSTATUS = '1'",
"RACE",28,"Demographics",6,"Person Demographics",5,"2021 National, 2021 Metro, 2019 National, 2019 Metro, 2017 National, 2017 Metro, 2015 National, 2015 Metro","PUF","Race of person","PERSON","Character","JRACE","Coming soon","01: White only||02: Black only||03: American Indian, Alaska Native only||04: Asian only||05: Hawaiian, Pacific Islander only||06: White / Black||07: White / American Indian, Alaska Native||08: White / Asian||09: White / Hawaiian, Pacific Islander||10: Black / American Indian, Alaska Native||11: Black / Asian||12: Black / Hawaiian, Pacific Islander||13: American Indian, Alaska Native / Asian||14: Asian / Hawaiian, Pacific Islander||15: White / Black / American Indian, Alaska Native||16: White / Black / Asian||17: White / American Indian, Alaska Native / Asian||18: White / Asian / Hawaiian, Pacific Islander||19: White / Black / American Indian, Alaska Native / Asian||20: Other combinations of 2 or 3 races||21: Other combinations of 4 or more races","Please choose one or more races that you consider yourself to be.","RACE","None","INTSTATUS = '1'","The IUF contains the following additional response code detail: 20=""Other combinations of 2 or 3 races,"" 21=""Other combinations of 4 or 5 races."" On the PUF, response code 20 refers to ""Other combinations of 2 or more races""."
"RACEAS",29,"Demographics",6,"Person Demographics",5,"2021 National, 2021 Metro, 2019 National, 2019 Metro, 2017 National, 2017 Metro, 2015 National, 2015 Metro","PUF","Race of person (Asian group)","PERSON","Character","JRACEAS","Coming soon","1: Asian Indian only||2: Chinese only||3: Filipino only||4: Japanese only||5: Korean only||6: Vietnamese only||7: Some other Asian race only||8: Two or more Asian races||N or -6: Not applicable","Which of the following Asian groups are you?","RACEAS","None","INTSTATUS = '1' and RACE in ('04' '08' '11' '13' '14' '16' '17' '18' '19' '20' '21')",
"RACEPI",30,"Demographics",6,"Person Demographics",5,"2021 National, 2021 Metro, 2019 National, 2019 Metro, 2017 National, 2017 Metro, 2015 National, 2015 Metro","PUF","Race of person (Native Hawaiian or other Pacific Islander group)","PERSON","Character","JRACEPI","Coming soon","1: Native Hawaiian only||2: Guamanian or Chamorro only||3: Samoan only||4: Some other Pacific Islander race only||5: Two or more Native Hawaiian or Pacific Islander races||N or -6: Not applicable","Which of the following Native Hawaiian or other Pacific Islander groups are you?","RACEPI","None","INTSTATUS = '1' and RACE in ('05' '09' '12' '14' '18' '20' '21')",
"REL",31,"Demographics",6,"Person Demographics",5,"2021 National, 2021 Metro, 2019 National, 2019 Metro, 2017 National, 2017 Metro, 2015 National, 2015 Metro","PUF","Relationship of person to reference person","PERSON","Character","JREL","Coming soon","01: Reference person with relatives in household||02: Reference person without relatives in household||03: Spouse (husband / wife)||04: Child of reference person||05: Grandchild of reference person||06: Parent of reference person||07: Sibling (brother / sister) of reference person||08: Other relative of reference person||09: Foster child of reference person||10: Unmarried partner (with own relatives)||11: Unmarried partner (without own relatives)||12: House / roommate (with own relatives)||13: House / roommate (without own relatives)||14: Roomer / boarder (with own relatives)||15: Roomer / boarder (without own relatives)||16: Other nonrelative (with own relatives)||17: Other nonrelative (without own relatives)","NA","NA","None","INTSTATUS = '1'","Multiple changes were made to this variable in 2015. A category was added for foster children. Its type was changed from numeric to character. The coding changed for all categories."
"RESPONDENT",32,"Demographics",6,"Person Demographics",5,"2021 National, 2021 Metro, 2019 National, 2019 Metro, 2017 National, 2017 Metro, 2015 National, 2015 Metro","PUF","Flag indicating this person is the respondent","PERSON","Character","JRESPONDENT","Coming soon","1: Yes||2: No","NA","NA","None","INTSTATUS = '1'",
"SECPARENT",33,"Demographics",6,"Person Demographics",5,"2021 National, 2021 Metro, 2019 National, 2019 Metro, 2017 National, 2017 Metro, 2015 National, 2015 Metro","PUF","Line number of parent number two","PERSON","Numeric","NA","Coming soon","1 : 30: 1 to 30||M or -9: Not reported||N or -6: Not applicable","NA","NA","None","INTSTATUS = '1'","There are two variables that represent the line numbers of the parents (FIRPARENT and SECPARENT)."
"SEX",34,"Demographics",6,"Person Demographics",5,"2021 National, 2021 Metro, 2019 National, 2019 Metro, 2017 National, 2017 Metro, 2015 National, 2015 Metro","PUF","Sex of person","PERSON","Character","JSEX","Coming soon","1: Male||2: Female","Are you male or female?","SEX","None","INTSTATUS = '1'",
"SPAN",35,"Demographics",6,"Person Demographics",5,"2021 National, 2021 Metro, 2019 National, 2019 Metro, 2017 National, 2017 Metro, 2015 National, 2015 Metro","PUF","Spanish origin of person","PERSON","Character","JSPAN","Coming soon","1: Yes||2: No","Are you Mexican, Mexican American, Chicano, Puerto Rican, Cuban, Cuban American, or some other Spanish, Hispanic, or Latino group?","ORISPN","None","INTSTATUS = '1'",
"SPOUSE",36,"Demographics",6,"Person Demographics",5,"2021 National, 2021 Metro, 2019 National, 2019 Metro, 2017 National, 2017 Metro, 2015 National, 2015 Metro","PUF","Line number of spouse of person","PERSON","Numeric","NA","Coming soon","1 : 30: 1 to 30||M or -9: Not reported||N or -6: Not applicable","NA","NA","None","INTSTATUS = '1' and MAR = '1' and AGE > 13 and AGE < 121",
"PCARE",1,"Demographics",6,"Person Disability",6,"2021 National, 2021 Metro, 2019 National, 2019 Metro, 2017 National, 2017 Metro, 2015 National, 2015 Metro","PUF","Flag indicating this person has difficulty dressing or bathing","PERSON","Character","JPCARE","Coming soon","1: Yes||2: No||M or -9: Not reported||N or -6: Not applicable","Do you have difficulty dressing or bathing?","SELFCARE","None","INTSTATUS = '1' and AGE >= 5",
"PERRND",2,"Demographics",6,"Person Disability",6,"2021 National, 2021 Metro, 2019 National, 2019 Metro, 2017 National, 2017 Metro, 2015 National, 2015 Metro","PUF","Flag indicating this person has difficulty doing errands","PERSON","Character","JPERRND","Coming soon","1: Yes||2: No||M or -9: Not reported||N or -6: Not applicable","Because of a physical, mental, or emotional condition, do you have difficulty doing errands alone such as visiting a doctor's office or shopping?","ERRANDS","None","INTSTATUS = '1' and AGE >= 15",
"PHEAR",3,"Demographics",6,"Person Disability",6,"2021 National, 2021 Metro, 2019 National, 2019 Metro, 2017 National, 2017 Metro, 2015 National, 2015 Metro","PUF","Flag indicating this person has difficulty hearing","PERSON","Character","JPHEAR","Coming soon","1: Yes||2: No||M or -9: Not reported||N or -6: Not applicable","Are you deaf or do you have serious difficulty hearing?","HEARING","None","INTSTATUS = '1'",
"PMEMRY",4,"Demographics",6,"Person Disability",6,"2021 National, 2021 Metro, 2019 National, 2019 Metro, 2017 National, 2017 Metro, 2015 National, 2015 Metro","PUF","Flag indicating this person has difficulty concentrating or remembering","PERSON","Character","JPMEMRY","Coming soon","1: Yes||2: No||M or -9: Not reported||N or -6: Not applicable","Because of a physical, mental, or emotional condition, do you have serious difficulty concentrating, remembering, or making decisions?","MEMRY","None","INTSTATUS = '1' and AGE >= 5",
"PSEE",5,"Demographics",6,"Person Disability",6,"2021 National, 2021 Metro, 2019 National, 2019 Metro, 2017 National, 2017 Metro, 2015 National, 2015 Metro","PUF","Flag indicating this person has difficulty seeing","PERSON","Character","JPSEE","Coming soon","1: Yes||2: No||M or -9: Not reported||N or -6: Not applicable","Are you blind or do you have serious difficulty seeing even when wearing glasses?","SEEING","None","INTSTATUS = '1'",
"PWALK",6,"Demographics",6,"Person Disability",6,"2021 National, 2021 Metro, 2019 National, 2019 Metro, 2017 National, 2017 Metro, 2015 National, 2015 Metro","PUF","Flag indicating this person has difficulty walking or climbing stairs","PERSON","Character","JPWALK","Coming soon","1: Yes||2: No||M or -9: Not reported||N or -6: Not applicable","Do you have serious difficulty walking or climbing stairs?","WALKING","None","INTSTATUS = '1' and AGE >= 5",
"CROPSL",1,"Income",7,"Total Household Income",1,"2021 National, 2021 Metro, 2019 National, 2019 Metro, 2017 National, 2017 Metro, 2015 National, 2015 Metro","IUF Only","Flag indicating farm income of $1,000 or more (past 12 months)","HOUSEHOLD","Character","JCROPSL","Coming soon","1: Yes||2: No||M or -9: Not reported||N or -6: Not applicable","In the 12 months prior to the date of the interview, did sales of crops, livestock, and other farm products from this place amount to $1,000 or more?","CROPSL","Withheld","INTSTATUS = '1' and URBAN_2010 = '3' and LOTSIZE >= 1 and (COUNT (SEMP <> 0) > 1)",
"FINCP",2,"Income",7,"Total Household Income",1,"2021 National, 2021 Metro, 2019 National, 2019 Metro, 2017 National, 2017 Metro, 2015 National, 2015 Metro","PUF","Family income (past 12 months)","HOUSEHOLD","Numeric","JFINCP","Coming soon","-99999999 : 99999998: -$99,999,999 to $99,999,998||99999999: $99,999,999 or more||N or -6: Not applicable","NA","NA","Topcoded","INTSTATUS = '1'","FINCP is the sum of all types of income for the householder and all related individuals age 16 and over."
"FS",3,"Income",7,"Total Household Income",1,"2021 National, 2021 Metro, 2019 National, 2019 Metro, 2017 National, 2017 Metro","PUF","Flag indicating food stamp or supplemental nutrition assistance program recipiency (past 12 months)","HOUSEHOLD","Character","JFS","Coming soon","1: Yes||2: No||M or -9: Not reported||N or -6: Not applicable","In the 12 months prior to the date of the interview, did you receive benefits from the Food Stamp Benefits Program or SNAP (the Supplemental Nutrition Assistance Program)?","QFS1","None","INTSTATUS = '1' and at least 1 person has income below $30,000 per year or PAP > 0 or prior year FS = '1'","The universe for FS changed between 2015 and 2017. In 2015 the universe was based on family income and the number of people in the unit. In 2017 it was based on the individual income of people in the unit and other factors such as reporting income from Temporary Assistance for Needy Families (TANF) or if the household reported receiving food assistance in 2015. The 2015 ""conditions in universe"" was INTSTATUS = '1' and ((NUMPEOPLE = 1) and (FINCP <= 35010)) or if ((NUMPEOPLE = 2) and (FINCP <= 47190)) or if ((NUMPEOPLE = 3) and (FINCP <= 59370)) or if ((NUMPEOPLE = 4) and (FINCP <= 71550)) or if ((NUMPEOPLE = 5) and (FINCP <= 83730)) or if ((NUMPEOPLE = 6) and (FINCP <= 95910)) or if ((NUMPEOPLE = 7) and (FINCP <= 108090)) or if ((NUMPEOPLE >= 8) and (FINCP <= 120270))"
"HINCP",4,"Income",7,"Total Household Income",1,"2021 National, 2021 Metro, 2019 National, 2019 Metro, 2017 National, 2017 Metro, 2015 National, 2015 Metro","PUF","Household income (past 12 months)","HOUSEHOLD","Numeric","JHINCP","Coming soon","-99999999 : 99999998: -$99,999,999 to $99,999,998||99999999: $99,999,999 or more||N or -6: Not applicable","NA","NA","Topcoded","INTSTATUS = '1'","HINCP is the sum of all types of income for all household members age 16 and over."
"INTP",1,"Income",7,"Person Income",3,"2021 National, 2021 Metro, 2019 National, 2019 Metro","PUF","Person's interest, dividends, and net rental income (past 12 months)","PERSON","Numeric","JINTP","Coming soon","0: Does not receive income from interest, dividends or rents||-9999998 : 9999998: -$9,999,998 to $9,999,998||9999999: $9,999,999 or more||N or -6: Not applicable","See User Notes","See User Notes","Rounded/Topcoded","INTSTATUS = '1' and AGE >= 16 and REL <= '08'","INTP is the sum of amounts reported for INTQ, DIVQ, and RENTQ: <br/> Respondents were first asked QINT (In the 12 months prior to the date of the interview did you receive interest from savings, money market funds, CDs, or other interest bearing accounts?), and if they replied yes, were then asked INTQ (What was the amount received?). <br/> The same is true of QDIV and DIVQ (Did you have any dividends from stock?), and QRENT and RENTQ (Did you receive net rental income?)."
"OIP",2,"Income",7,"Person Income",3,"2021 National, 2021 Metro, 2019 National, 2019 Metro","PUF","Person's other income (past 12 months)","PERSON","Numeric","JOIP","Coming soon","0: Does not receive income from alimony, Workers' Compensation or other||1 : 9999997: $1 to $9,999,997||9999998: $9,999,998 or more||N or -6: Not applicable","See User Notes","See User Notes","Rounded/Topcoded","INTSTATUS = '1' and AGE >= 16","For all relatives of the reference person, OIP is the sum of amounts reported for worker's compensation, alimony, and any other income not previously reported. When the person is not a relative of the reference person, OIP is the sum of all types of income, except wages or salary and self-employment income. <br/> The related items are QWKCMPQ (In the 12 months prior to the date of the interview did you receive any disability payments such as SSDI, worker's compensation, veteran's disability or other disability payments?), and it's follow-up WKCMPQ (What was the amount received?), and QALIM and ALIMQ (Did you receive alimony or child support?), and QOTHER and OTHERQ (Did you regularly receive income from any other sources, such as Veteran's (VA) payments or unemployment compensation?)."
"PAP",3,"Income",7,"Person Income",3,"2021 National, 2021 Metro, 2019 National, 2019 Metro, 2017 National, 2017 Metro","PUF","Person's public assistance income (past 12 months)","PERSON","Numeric","JPAP","Coming soon","0: Does not receive public assistance income||1 : 99997: $1 to $99,997||99998: $99,998||N or -6: Not applicable","See User Notes","WELFQ","Rounded/Topcoded","INTSTATUS = '1' and AGE >= 16 and Rel <= '08'","Respondents were first asked QWELF (In the 12 months prior to the date of the interview did you receive any public assistance, such as Temporary Assistance for Needy Families (TANF), or public welfare cash assistance from the state or local welfare office?), and if they replied yes, were then asked WELFQ (What was that amount?)."
"RETP",4,"Income",7,"Person Income",3,"2021 National, 2021 Metro, 2019 National, 2019 Metro, 2017 National, 2017 Metro, 2015 National, 2015 Metro","PUF","Person's retirement income (past 12 months)","PERSON","Numeric","JRETP","Coming soon","0: Does not receive retirement income||1 : 9999997: $1 to $9,999,997||9999998: $9,999,998 or more||N or -6: Not applicable","See User Notes","RETIRQ","Rounded/Topcoded","INTSTATUS = '1' and AGE >= 16 and REL <= '08'","Respondents were first asked QRETIR (In the 12 months prior to the date of the interview did you receive any retirement or survivor pensions?), and if they replied yes, were then asked RETIRQ (What was that amount?)."
"SEMP",5,"Income",7,"Person Income",3,"2021 National, 2021 Metro, 2019 National, 2019 Metro, 2017 National, 2017 Metro, 2015 National, 2015 Metro","PUF","Person's self-employment income (past 12 months)","PERSON","Numeric","JSEMP","Coming soon","0: Does not receive self-employment income||-9999998 : 9999997: -$9,999,998 to $9,999,997||9999998: $9,999,998 or more||N or -6: Not applicable","See User Notes","SELFQ","Rounded/Topcoded","INTSTATUS = '1' and AGE >= 16","Respondents were first asked QSELF (In the 12 months prior to the date of the interview did you receive any self-employment income?), and if they replied yes, were then asked SELFQ (What was that amount?)."
"SSIP",6,"Income",7,"Person Income",3,"2021 National, 2021 Metro, 2019 National, 2019 Metro, 2017 National, 2017 Metro, 2015 National, 2015 Metro","PUF","Person's Supplemental Security Income (past 12 months)","PERSON","Numeric","JSSIP","Coming soon","0: Does not receive Supplemental Security Income||1 : 99997: $1 to $99,997||99998: $99,998 or more||N or -6: Not applicable","See User Notes","SSIQ","Rounded/Topcoded","INTSTATUS = '1' and AGE >= 16 and REL <= '08'","Respondents were first asked QSSI (In the 12 months prior to the date of the interview did you receive any Supplemental Security Income (SSI) payments?), and if they replied yes, were then asked SSIQ (What was that amount?)"
"SSP",7,"Income",7,"Person Income",3,"2021 National, 2021 Metro, 2019 National, 2019 Metro, 2017 National, 2017 Metro, 2015 National, 2015 Metro","PUF","Person's Social Security income (past 12 months)","PERSON","Numeric","JSSP","Coming soon","0: Does not receive Social Security or railroad income||1 : 9999997: $1 to $9,999,997||9999998: $9,999,998 or more||N or -6: Not applicable","See User Notes","SSQ","Rounded/Topcoded","INTSTATUS = '1' and AGE >= 16 and REL <= '08'","Respondents were first asked QSS (In the 12 months prior to the date of the interview did you receive any Social Security or Railroad Retirement benefits?), and if they replied yes, were then asked SSQ (What was that amount?)."
"WAGP",8,"Income",7,"Person Income",3,"2021 National, 2021 Metro, 2019 National, 2019 Metro, 2017 National, 2017 Metro, 2015 National, 2015 Metro","PUF","Person's wages or salary income (past 12 months)","PERSON","Numeric","JWAGP","Coming soon","0: Does not receive wage income||1 : 9999997: $1 to $9,999,997||9999998: $9,999,998 or more||N or -6: Not applicable","See User Notes","SALQ","Rounded/Topcoded","INTSTATUS = '1' and AGE >= 16","Respondents were first asked QSAL (In the 12 months prior to the date of the interview did you receive any wages, salary, commissions, bonuses, or tips?), and if they replied yes, were then asked SALQ (How much did you receive in the last 12 months)."
"HOAAMT",1,"Housing Costs",8,"Total Housing Cost",1,"2021 National, 2021 Metro, 2019 National, 2019 Metro","PUF","Monthly homeowners or condominium association amount","HOUSEHOLD","Numeric","JHOAAMT","Coming soon","0 : 48565: $0 to $48,565||48566: $48,566 or more||M or -9: Not reported||N or -6: Not applicable","See User Notes","See User Notes","Noise","( ( INTSTATUS = '1' and TENURE = '1') or ( INTSTATUS in ( '2' '3' ) and VACANCY in ( '03' '05' ) ) ) or ( BLD = '01' and ( ( INTSTATUS = '1' and TENURE in ( '2' '3' ) ) or ( INTSTATUS in ( '2' '3' ) and VACANCY in ( '01' '02' '04' ) ) ) )","HOAAMT is determined from multiple variables, including those that ask about homeowner, condominium, or cooperative association fees (IFFEEHO, CAMFHO, FEEAMTHO), manufactured / mobile home park fees (IFFEEMH1/2, CAMFMH1/2, FEEAMTMH1/2), and other fees for utility hookups, mobile home association fees, and so forth (IFOTHF1/2, FMHOTF1/2, MHOTFE1/2). The values shown in the microdata have been converted to monthly amounts."
"INSURAMT",2,"Housing Costs",8,"Total Housing Cost",1,"2021 National, 2021 Metro, 2019 National, 2019 Metro, 2017 National, 2017 Metro, 2015 National, 2015 Metro","PUF","Monthly homeowner or renter insurance amount","HOUSEHOLD","Numeric","JINSURAMT","Coming soon","0 : 832: $0 to $832||833: $833 or more||M or -9: Not reported||N or -6: Not applicable","See User Notes","See User Notes","Noise","INTSTATUS = '1'","Respondents are first asked BUYI1/2 (Does this household have property insurance?), and if they reply yes, then asked the amount. The values shown on the microdata has been converted to a monthly amount."
"LOTAMT",3,"Housing Costs",8,"Total Housing Cost",1,"2021 National, 2021 Metro, 2019 National, 2019 Metro","PUF","Monthly lot rent amount","HOUSEHOLD","Numeric","JLOTAMT","Coming soon","0: Does not pay lot rent or included in park or association fee||1 : 9995: $1 to $9,995||9996: $9,996 or more||M or -9: Not reported||N or -6: Not applicable","See User Notes","See User Notes","Noise","INTSTATUS in ('1' '2' '3') and (BLD = '01' and OWNLOT <> '1' and (TENURE in ('1' '2' '3') or VACANCY in ('01' '02' '03' '04' '05'))) or (OWNLOT = '2' and (TENURE = '1' or VACANCY in ('03' '05')))","Respondents are first asked INCS (Do you pay rent for the land?), and if they reply yes, then asked FLRENT (How many times a year is the land/site rent due?), then asked LRENT (What is the cost?). The values shown in the microdata have been converted to monthly amounts."
"MORTAMT",4,"Housing Costs",8,"Total Housing Cost",1,"2021 National, 2021 Metro, 2019 National, 2019 Metro, 2017 National, 2017 Metro, 2015 National, 2015 Metro","PUF","Monthly total mortgage amount (all mortgages)","HOUSEHOLD","Numeric","JMORTAMT","Coming soon","-9999997: -$9,999,997 or less||-9999996 : 9999996: -$9,999,996 to $9,999,996||9999997: $9,999,997 or more||M or -9: Not reported||N or -6: Not applicable","NA","NA","Noise","INTSTATUS = '1' and TENURE = '1' and MORTSTAT in ('2' '3' '4' '5')","MORTAMT is the sum of PMTAMT (mortgage payment amount) across all mortgages. Some households' property tax and/or homeowner insurance payments are included in a mortgage payment. The property tax and/or homeowner insurance amounts are subtracted from the sum of PMTAMT in such cases. Occasionally the amount of property tax and/or homeowner insurance is greater than the mortgage payment, creating a negative MORTAMT value."
